{
  "version": "1.0",
  "prd_path": "skills/prd-to-canvas/examples/ai-coach-demo/00-raw-prd.md",
  "total_lines": 282,
  "scanned_at": "2026-05-17T19:35:00Z",
  "candidates": [
    { "id": "c001", "type": "H", "subtype": "h1", "line_start": 1, "line_end": 1, "raw_excerpt": "# 新手陪练 AI 教练 · PRD", "confidence": "high", "action": "keep" },
    { "id": "c002", "type": "QT", "line_start": 3, "line_end": 4, "raw_excerpt": "> 一份故意写得\"半结构化\"的 demo PRD…\n> PM 草稿状态——有 emoji、有 ASCII 流程图…", "confidence": "high", "action": "keep" },
    { "id": "c003", "type": "TBL", "line_start": 6, "line_end": 11, "raw_excerpt": "| 项 | 值 |\n| --- | --- |\n| owner | 张三（IEG 游戏 AI 中台） |\n...", "confidence": "high", "action": "keep", "context": { "rows": 4, "cols": 2, "purpose": "元信息" } },
    { "id": "c004", "type": "HR", "line_start": 13, "line_end": 13, "raw_excerpt": "---", "confidence": "high", "action": "keep" },
    { "id": "c005", "type": "H", "subtype": "h2", "line_start": 15, "line_end": 15, "raw_excerpt": "## 1. 背景", "confidence": "high", "action": "keep" },
    { "id": "c006", "type": "P", "line_start": 17, "line_end": 17, "raw_excerpt": "王者荣耀新手玩家流失率高（首周流失 47%）…", "confidence": "high", "action": "keep" },
    { "id": "c007", "type": "P", "line_start": 19, "line_end": 19, "raw_excerpt": "教练有 3 种人设（鼓励型 / 严厉型 / 战术型）…", "confidence": "high", "action": "keep" },
    { "id": "c008", "type": "CALL-N", "subtype": "warning", "line_start": 21, "line_end": 21, "raw_excerpt": "⚠️ 本期 demo 期没有真后端，前端直接 mock 教练响应，演示用。", "confidence": "medium", "action": "upgrade", "needs_user_input": ["callout_subtype"], "rewrite_preview": "> [!warning]\n> 本期 demo 期没有真后端，前端直接 mock 教练响应，演示用。" },
    { "id": "c009", "type": "H", "subtype": "h2", "line_start": 23, "line_end": 23, "raw_excerpt": "## 2. 目标 + 非目标", "confidence": "high", "action": "keep" },
    { "id": "c010", "type": "UL", "line_start": 26, "line_end": 28, "raw_excerpt": "· 新手首周留存提升 5pp（北极星）\n· 战后教练触发率…\n· 教练响应 p95 ≤ 1.5s", "confidence": "medium", "action": "upgrade", "rewrite_preview": "- 新手首周留存提升 5pp（北极星）\n- 战后教练触发率（玩家主动看完）≥ 30%\n- 教练响应 p95 ≤ 1.5s", "context": { "bullet_char": "·" } },
    { "id": "c011", "type": "UL", "line_start": 31, "line_end": 33, "raw_excerpt": "· 不做 PvP 对手分析\n· 不做付费英雄推荐\n· 本期不做语音教练（v2 再说）", "confidence": "medium", "action": "upgrade", "rewrite_preview": "- 不做 PvP 对手分析\n- 不做付费英雄推荐\n- 本期不做语音教练（v2 再说）", "context": { "bullet_char": "·" } },
    { "id": "c012", "type": "H", "subtype": "h2", "line_start": 35, "line_end": 35, "raw_excerpt": "## 3. 用户场景", "confidence": "high", "action": "keep" },
    { "id": "c013", "type": "TBL", "line_start": 37, "line_end": 41, "raw_excerpt": "| 角色 | 场景 | 痛点 |\n| --- | --- | --- |\n...", "confidence": "high", "action": "keep", "context": { "rows": 3, "cols": 3, "purpose": "用户场景" } },
    { "id": "c014", "type": "CALL-N", "subtype": "caution", "line_start": 43, "line_end": 43, "raw_excerpt": "**注意：** 我们不要让教练打击新手玩家自信。任何带\"菜\"、\"垃圾\"、\"演员\"等贬义词的回复一律拦截。", "confidence": "medium", "action": "upgrade", "needs_user_input": ["callout_subtype"], "rewrite_preview": "> [!caution]\n> 我们不要让教练打击新手玩家自信。任何带\"菜\"、\"垃圾\"、\"演员\"等贬义词的回复一律拦截。" },
    { "id": "c015", "type": "H", "subtype": "h2", "line_start": 45, "line_end": 45, "raw_excerpt": "## 4. 方案概览", "confidence": "high", "action": "keep" },
    { "id": "c016", "type": "P", "line_start": 47, "line_end": 47, "raw_excerpt": "用户战后回到大厅，自动弹一个浮窗\"想听小助手讲讲这把吗？\"…", "confidence": "high", "action": "keep" },
    { "id": "c017", "type": "CODE", "line_start": 51, "line_end": 53, "raw_excerpt": "玩家战后回大厅 → 检查段位 < 黄金 → 弹浮窗 → 用户点确认 → 调后端取教练总结 → 渲染卡片 → 可选练习引导", "confidence": "medium", "action": "keep", "context": { "lang_missing": true, "looks_like": "ascii flowchart" } },
    { "id": "c018", "type": "MERMAID", "line_start": 49, "line_end": 55, "raw_excerpt": "整体流程：\n```\n玩家战后回大厅 → 检查段位 < 黄金 → 弹浮窗 → ... → 可选练习引导\n```\n（上面这段是文字描述，应该图化）", "confidence": "medium", "action": "upgrade", "needs_user_input": ["mermaid_kind"], "rewrite_preview": "```mermaid\nflowchart LR\n  A[玩家战后回大厅] --> B{段位 < 黄金?}\n  B -- 是 --> C[弹浮窗]\n  C --> D[用户点确认]\n  D --> E[调后端取教练总结]\n  E --> F[渲染卡片]\n  F --> G[可选练习引导]\n```", "context": { "displaces_candidate_ids": ["c017"] } },
    { "id": "c019", "type": "H", "subtype": "h2", "line_start": 57, "line_end": 57, "raw_excerpt": "## 5. 教练人设", "confidence": "high", "action": "keep" },
    { "id": "c020", "type": "H", "subtype": "h3", "line_start": 59, "line_end": 59, "raw_excerpt": "### 5.1 鼓励型（妹妹系）", "confidence": "high", "action": "keep" },
    { "id": "c021", "type": "CODE", "line_start": 61, "line_end": 69, "raw_excerpt": "你是用户的桌宠\"小妹\"。你扮演一个温柔耐心的新手陪练。\n说话风格：\n...", "confidence": "high", "action": "keep", "context": { "lang_missing": true } },
    { "id": "c022", "type": "PROMPT", "line_start": 61, "line_end": 69, "raw_excerpt": "你是用户的桌宠\"小妹\"。你扮演一个温柔耐心的新手陪练。...", "confidence": "medium", "action": "suggest", "context": { "persona_name": "encouraging", "length_chars": 145, "note": "已在 code fence 中，可在 canvas 加 Prompt 块跑真模型" } },
    { "id": "c023", "type": "H", "subtype": "h3", "line_start": 71, "line_end": 71, "raw_excerpt": "### 5.2 严厉型（教官系）", "confidence": "high", "action": "keep" },
    { "id": "c024", "type": "PROMPT", "line_start": 73, "line_end": 79, "raw_excerpt": "你扮演一个老兵教官。说话风格：\n- 直接、不绕弯\n- 用术语：补刀 / 视野 / gank 节奏 / 经济线...", "confidence": "medium", "action": "suggest", "needs_user_input": ["prompt_name"], "context": { "persona_name": "strict", "length_chars": 110, "note": "散落正文，可在 canvas 加 Prompt 块" } },
    { "id": "c025", "type": "UL", "line_start": 74, "line_end": 77, "raw_excerpt": "- 直接、不绕弯\n- 用术语：补刀 / 视野 / gank 节奏 / 经济线\n- 一次最多讲 2 个核心问题\n- 不带情绪，只给事实和建议", "confidence": "high", "action": "keep" },
    { "id": "c026", "type": "H", "subtype": "h3", "line_start": 81, "line_end": 81, "raw_excerpt": "### 5.3 战术型（学者系）", "confidence": "high", "action": "keep" },
    { "id": "c027", "type": "PROMPT", "line_start": 83, "line_end": 86, "raw_excerpt": "你是一名游戏赛事分析师。说话风格学术：\n- 引用具体数据（你的 KDA / 经济差 / 团战参与率）...", "confidence": "medium", "action": "suggest", "needs_user_input": ["prompt_name"], "context": { "persona_name": "analyst", "length_chars": 95, "note": "散落正文，可在 canvas 加 Prompt 块" } },
    { "id": "c028", "type": "UL", "line_start": 84, "line_end": 86, "raw_excerpt": "- 引用具体数据（你的 KDA / 经济差 / 团战参与率）\n- 分析\"为什么\"而不是\"是什么\"\n- 给出对比基准（\"同段位平均补刀是 X，你是 Y\"）", "confidence": "high", "action": "keep" },
    { "id": "c029", "type": "H", "subtype": "h2", "line_start": 88, "line_end": 88, "raw_excerpt": "## 6. 接口设计", "confidence": "high", "action": "keep" },
    { "id": "c030", "type": "H", "subtype": "h3", "line_start": 90, "line_end": 90, "raw_excerpt": "### 6.1 /coach/match-debrief 战后总结接口", "confidence": "high", "action": "keep" },
    { "id": "c031", "type": "API-B", "line_start": 90, "line_end": 120, "raw_excerpt": "### 6.1 /coach/match-debrief 战后总结接口 + 表格(method=POST, url=/coach/match-debrief) + 输入JSON + 输出JSON", "confidence": "high", "action": "upgrade", "needs_user_input": ["status_codes_4xx_5xx"], "rewrite_preview": "```api\nname: 战后总结接口\nmethod: POST\nurl: /coach/match-debrief\nstatus: 200\ndescription: 战后调一次，拿当局复盘\nrequest: |\n  {\n    \"user_id\": \"u_001\",\n    \"match_id\": \"m_20260517_001\",\n    \"persona\": \"encouraging\",\n    \"language\": \"zh-CN\"\n  }\nresponse: |\n  {\n    \"summary_text\": \"哥哥这把节奏不错呀~ ...\",\n    \"highlights\": [...],\n    \"improvement_tip\": \"...\",\n    \"duration_ms\": 870\n  }\n# TODO: 补 4xx/5xx\n```", "context": { "method": "POST", "url": "/coach/match-debrief", "has_request_json": true, "has_response_json": true, "missing_status": ["4xx", "5xx"] } },
    { "id": "c032", "type": "MOCK", "line_start": 90, "line_end": 120, "raw_excerpt": "/coach/match-debrief 接口", "confidence": "high", "action": "suggest", "context": { "method": "POST", "url": "/coach/match-debrief", "note": "demo 期无后端，建议建 Mock 块" } },
    { "id": "c033", "type": "H", "subtype": "h3", "line_start": 122, "line_end": 122, "raw_excerpt": "### 6.2 /coach/skill-tip 单技能解释接口", "confidence": "high", "action": "keep" },
    { "id": "c034", "type": "API-B", "line_start": 122, "line_end": 147, "raw_excerpt": "### 6.2 /coach/skill-tip 单技能解释接口 + 表格(GET, /coach/skill-tip) + 输入JSON + 输出JSON", "confidence": "high", "action": "upgrade", "needs_user_input": ["status_codes_4xx_5xx"], "rewrite_preview": "```api\nname: 单技能解释接口\nmethod: GET\nurl: /coach/skill-tip\nstatus: 200\ndescription: 玩家查看英雄时调，解释一个技能的最佳用法\nrequest: |\n  {...}\nresponse: |\n  {...}\n# TODO: 补 4xx/5xx\n```", "context": { "method": "GET", "url": "/coach/skill-tip" } },
    { "id": "c035", "type": "MOCK", "line_start": 122, "line_end": 147, "raw_excerpt": "/coach/skill-tip 接口", "confidence": "high", "action": "suggest", "context": { "method": "GET", "url": "/coach/skill-tip" } },
    { "id": "c036", "type": "H", "subtype": "h3", "line_start": 149, "line_end": 149, "raw_excerpt": "### 6.3 /coach/config 教练配置接口", "confidence": "high", "action": "keep" },
    { "id": "c037", "type": "API-B", "line_start": 149, "line_end": 175, "raw_excerpt": "### 6.3 /coach/config 教练配置接口 + 表格(PUT, /coach/config) + 输入JSON + 输出JSON", "confidence": "high", "action": "upgrade", "needs_user_input": ["status_codes_4xx_5xx"], "rewrite_preview": "```api\nname: 教练配置接口\nmethod: PUT\nurl: /coach/config\nstatus: 200\ndescription: 玩家在设置页改人设/开关/语言\nrequest: |\n  {...}\nresponse: |\n  {...}\n# TODO: 补 4xx/5xx\n```", "context": { "method": "PUT", "url": "/coach/config" } },
    { "id": "c038", "type": "MOCK", "line_start": 149, "line_end": 175, "raw_excerpt": "/coach/config 接口", "confidence": "high", "action": "suggest", "context": { "method": "PUT", "url": "/coach/config" } },
    { "id": "c039", "type": "H", "subtype": "h2", "line_start": 177, "line_end": 177, "raw_excerpt": "## 7. 工具清单（Agent 后端）", "confidence": "high", "action": "keep" },